{"execution_id":"syn-execution","authorization_id":"syn-auth","approval_id":"syn-approval","intent_id":"syn-i","intent_hash":"sha256:687bc9894622b0eea1d025fd8c1bb17af051184eca718a2863ec0ed5ac3b06e6","executor_id":"synthetic-executor-not-invoked","idempotency_key":"syn-k","attempted_at":"2026-09-03T02:20:00Z","status":"CANCELLED","side_effect_state":"NOT_PERFORMED","correlation_id":"syn-c"}
